{
  "schema_version": 1,
  "object_type": "counterpower_intervention_lane",
  "lane_id": "HRDCI-02",
  "title": "Blizzard QA-CWA: ratified AI and accommodation guardrails",
  "instrument_id": "blizzard-qa-ratified-ai-contract",
  "organizations": [
    "Blizzard Albany QA-CWA",
    "Blizzard Austin QA-CWA",
    "Communications Workers of America",
    "Microsoft"
  ],
  "instrument_type": "ratified_collective_bargaining_agreement_public_summary",
  "counterpower_entry_stage": "pre_deployment_contract",
  "highest_publicly_recovered_depth_level": 3,
  "source_ids": [
    "cwa-ai-principles-2023",
    "cwa-blizzard-ai-contract-2026",
    "cwa-microsoft-zenimax-neutrality-2024",
    "nlrb-concerted-activity"
  ],
  "observations": [
    {
      "id": "HRDCI-02-O01",
      "claim": "CWA reported that Blizzard quality-assurance workers in Albany and Austin ratified a three-year union contract on 30 January 2026.",
      "state": "observed_ratified_contract",
      "source_ids": [
        "cwa-ai-principles-2023",
        "cwa-blizzard-ai-contract-2026",
        "cwa-microsoft-zenimax-neutrality-2024",
        "nlrb-concerted-activity"
      ],
      "limits": [
        "Bounded to the cited public record and instrument posture."
      ]
    },
    {
      "id": "HRDCI-02-O02",
      "claim": "The public summary states that the contract contains enhanced regulations for AI and generative AI intended to support rather than replace or harm workers.",
      "state": "observed_ai_guardrail_summary",
      "source_ids": [
        "cwa-ai-principles-2023",
        "cwa-blizzard-ai-contract-2026",
        "cwa-microsoft-zenimax-neutrality-2024",
        "nlrb-concerted-activity"
      ],
      "limits": [
        "Bounded to the cited public record and instrument posture."
      ]
    },
    {
      "id": "HRDCI-02-O03",
      "claim": "The same summary reports reasonable disability accommodations without discrimination or retaliation.",
      "state": "observed_accommodation_guardrail_summary",
      "source_ids": [
        "cwa-ai-principles-2023",
        "cwa-blizzard-ai-contract-2026",
        "cwa-microsoft-zenimax-neutrality-2024",
        "nlrb-concerted-activity"
      ],
      "limits": [
        "Bounded to the cited public record and instrument posture."
      ]
    },
    {
      "id": "HRDCI-02-O04",
      "claim": "The contract also reports protections involving fair crediting, immigrant-worker discipline and seniority, and excessive overtime.",
      "state": "observed_adjacent_worker_protections",
      "source_ids": [
        "cwa-ai-principles-2023",
        "cwa-blizzard-ai-contract-2026",
        "cwa-microsoft-zenimax-neutrality-2024",
        "nlrb-concerted-activity"
      ],
      "limits": [
        "Bounded to the cited public record and instrument posture."
      ]
    },
    {
      "id": "HRDCI-02-O05",
      "claim": "The bargaining units combined priorities across two locations, giving the contract a collective rather than individual complaint posture.",
      "state": "observed_multi_site_collective_bargaining",
      "source_ids": [
        "cwa-ai-principles-2023",
        "cwa-blizzard-ai-contract-2026",
        "cwa-microsoft-zenimax-neutrality-2024",
        "nlrb-concerted-activity"
      ],
      "limits": [
        "Bounded to the cited public record and instrument posture."
      ]
    },
    {
      "id": "HRDCI-02-O06",
      "claim": "The full contract, covered-system definitions, enforcement procedures and named deployment outcomes are not public in the recovered source.",
      "state": "observed_contract_text_blocked",
      "source_ids": [
        "cwa-ai-principles-2023",
        "cwa-blizzard-ai-contract-2026",
        "cwa-microsoft-zenimax-neutrality-2024",
        "nlrb-concerted-activity"
      ],
      "limits": [
        "Bounded to the cited public record and instrument posture."
      ]
    }
  ],
  "findings": [
    {
      "id": "HRDCI-02-F01",
      "claim": "A ratified collective agreement can join AI adoption, disability accommodation and discipline protections before a named adverse event occurs.",
      "status": "independently_supported_scoped",
      "source_ids": [
        "cwa-ai-principles-2023",
        "cwa-blizzard-ai-contract-2026",
        "cwa-microsoft-zenimax-neutrality-2024",
        "nlrb-concerted-activity"
      ],
      "limits": [
        "No unpublished term, universal prevalence, named-company intent, or complete worker outcome is inferred."
      ]
    },
    {
      "id": "HRDCI-02-F02",
      "claim": "Public description of “enhanced regulations” does not authorize inference of a veto, threshold disclosure, audit right, or grievance remedy absent the clause text.",
      "status": "bounded_synthesis",
      "source_ids": [
        "cwa-ai-principles-2023",
        "cwa-blizzard-ai-contract-2026",
        "cwa-microsoft-zenimax-neutrality-2024",
        "nlrb-concerted-activity"
      ],
      "limits": [
        "No unpublished term, universal prevalence, named-company intent, or complete worker outcome is inferred."
      ]
    },
    {
      "id": "HRDCI-02-F03",
      "claim": "The accommodation provision is a counterexample to treating disability-related variance as noncompliance by default, but its operation in an AI case is not publicly recovered.",
      "status": "bounded_synthesis",
      "source_ids": [
        "cwa-ai-principles-2023",
        "cwa-blizzard-ai-contract-2026",
        "cwa-microsoft-zenimax-neutrality-2024",
        "nlrb-concerted-activity"
      ],
      "limits": [
        "No unpublished term, universal prevalence, named-company intent, or complete worker outcome is inferred."
      ]
    },
    {
      "id": "HRDCI-02-F04",
      "claim": "No named alert, discipline transaction, appeal, restoration or system revision has been recovered under the contract.",
      "status": "remains_blocked",
      "source_ids": [
        "cwa-ai-principles-2023",
        "cwa-blizzard-ai-contract-2026",
        "cwa-microsoft-zenimax-neutrality-2024",
        "nlrb-concerted-activity"
      ],
      "limits": [
        "No unpublished term, universal prevalence, named-company intent, or complete worker outcome is inferred."
      ]
    }
  ],
  "open_questions": [
    "full_contract_text",
    "covered_ai_and_genai_definition",
    "notice_and_bargaining_duties",
    "accommodation_disposition_process",
    "grievance_and_arbitration_remedy",
    "deployment_and_outcome_records"
  ],
  "terminal_state": "ratified_predeployment_ai_and_accommodation_guardrails_recovered_clause_depth_and_operation_open",
  "authority": {
    "ai_caused_chloe_moffat_death_claims_allowed": false,
    "canonical_product_effects_allowed": false,
    "control_adoption_allowed": false,
    "dissonance_purge_universal_claims_allowed": false,
    "employer_liability_findings_allowed": false,
    "employer_specific_causation_findings_allowed": false,
    "final_coroner_conclusion_claims_allowed": false,
    "graph_effects_allowed": false,
    "individual_culpability_findings_allowed": false,
    "legal_conclusions_allowed": false,
    "named_company_intent_or_misuse_beyond_public_record_allowed": false,
    "parent_wave_mutation_allowed": false,
    "private_source_publication_allowed": false,
    "protected_activity_classification_claims_allowed": false,
    "publication_effects_allowed": false,
    "soft_partnership_as_collective_bargaining_claims_allowed": false,
    "unpublished_contract_term_inference_allowed": false,
    "universal_prevalence_findings_allowed": false,
    "victim_character_inferences_allowed": false
  }
}
